{
  "schema_version": "1.0",
  "role": "adversary",
  "attempt": 1,
  "run_id": "canary-run-002",
  "commit_sha": null,
  "timestamp_utc": "2026-01-15T10:00:00Z",
  "status": "success",
  "verdict": "PASS",
  "artefakte": [],
  "findings": [
    {
      "id": "F-001",
      "severity": "BLOCK",
      "title": "Blockierender Befund bleibt offen",
      "spec_ref": {
        "document": "docs/specs/SPEC-001.md"
      },
      "location": {
        "file": null,
        "line": null,
        "note": "Testdokument"
      },
      "reproduction": "Reproduktionsschritte: Schritt 1, Schritt 2, beobachtetes Verhalten weicht von der Erwartung ab."
    }
  ],
  "begruendung": "Widersprüchliches Dokument für den Schema-Test."
}